[
  {
    "id": "trace-lot-c01",
    "siteId": "11111111-1111-4111-8111-111111111111",
    "type": "transfer_executed",
    "lotId": "66666666-6666-4666-8666-666666666666",
    "sourceEntityType": "lot",
    "sourceEntityId": "LOT-2026-001",
    "targetEntityType": "tank",
    "targetEntityId": "C-01",
    "quantityLiters": 7200,
    "occurredAt": "2026-05-18T09:00:00.000Z",
    "actorId": "aaaaaaaa-aaaa-4aaa-8aaa-aaaaaaaaaaaa",
    "metadata": { "rule": "initial_load" },
    "createdAt": "2026-05-18T09:00:00.000Z",
    "updatedAt": "2026-05-18T09:00:00.000Z"
  }
]

